level|type|writing|english|swedish
n1|sentence|まゆさんは時々お茶を飲むと思います。|I think Mayu drinks tea from time to time.|Jag tror att Mayu dricker te ibland.
n1|sentence|まゆさんは時々お茶を飲むと言っています。|Mayu says she somteimes drinks tea.|Mayu säger att hon dricker te ibland
n1|sentence|まゆさんはいい歌手と思います。|I think Mayu is a good singer.|Jag tycker att Mayu är en bra sångare.
n1|sentence|エルビスはいい歌手と思いました。I thought that Elvis was a good singer.|Jag tyckte att Elvis var en bra sångare.
n1|sentence|まゆさんはかわいいと思います。|I think Mayu is cute.|Jag tycker att Mayu är söt.
n1|sentence|雪がふっています。|It's snowing.|Det snöar.
n1|sentence|私は白いスマートフォンを持っています。黒いの持っています。|I have a white smartphone. I have a black one too.|Jag har en vit smartphone. Jag har en svart också.